{"artifacts":[{"path":"dataset.json","sha256":"6f8c7bf9e353ab0f493976d27b4ac73d88143c23d59bf01913acb90d31987ca2","size_bytes":573},{"path":"events.json","sha256":"67fe4870e0a48670dac958b4bf7845adf7ae0fd09defd603795c801636cc1dc3","size_bytes":4281},{"path":"graph.json","sha256":"28aab711312addbb598fc73b27804139c303c584a7d4544b41d1d9c552220ab1","size_bytes":3344},{"path":"quality.json","sha256":"48bed226112b26f99ea745df7c3f87d1fa811530a7c0098302db31375afe7d81","size_bytes":180}],"attempt_id":1,"config_fingerprint":"2800d335c40a718951a5177242442c2e64ef0fe5f16455537e244da845471902","input_fingerprint":"30eebc238c24bd12f46a9fa84c021860b4f68299bab2d2a1dbf212dedadb2548","limitations":["Synthetic M1 only; independent timelines; no alignment, correlation, causal claims or detection evaluation."],"mode":"offline","result_hashes":{"events":"6bc5c305fb6170d032e1f6e23b3d85960a4289d4024cdee9e64ae4b993fcc3f8","graph":"90c2a820739f09a30cd3c3b7ed5e6eed99bb60f94d0c1b0410329dc7e2695225"},"run_id":"2f66fb22-86bd-49a9-8024-b3b952d572d1","schema_version":"1.0.0","status":"succeeded_with_warnings","synthetic":true,"tool_versions":{"core":"0.1.1","python":"3.12.15"},"warnings":["network: missing_response_status","process: missing_value","process: nonfinite_value"]}
