{"artifacts":[{"path":"dataset.json","sha256":"ee5f0231dd744a0c6e4e5c27ef09248d99d47c2f6948457b72cf0e521a123547","size_bytes":608},{"path":"events.json","sha256":"48bac19d8bb7524bebb1c6ed59686e7395d2b7a88fd9ab8d4d0919870c7f3188","size_bytes":1551},{"path":"graph.json","sha256":"bcd98ebef48a1c5d5d79f8108697dcefcb12cb86f629d53299d51569c9436130","size_bytes":2816},{"path":"quality.json","sha256":"cab3a2149d1c47cdfa32d52931cbdda65cb2d91d8afbba6a870598317bde3e92","size_bytes":91},{"path":"packet_observations.json","sha256":"05e55ef6456c935f975e993bcefb067713e5b3bc57099cd4d86a09168057cd84","size_bytes":15739}],"attempt_id":1,"config_fingerprint":"e6551c2bbaeec37fd4788ef7b7df6708da64e4ea1c1c2f78454aa3acc3370b66","input_fingerprint":"d16c044914c628fab59d944a016b328a6d3680e7fb7bcdca6515241d5ea727fd","limitations":["No industrial validation, causal/attack inference, physical success or clock alignment."],"mode":"offline","result_hashes":{"events":"f699fb8376864fa88e8d9ca7c75b057e622275a694469b7400e9f9e3eece0975","graph":"500fab6d4017eb5d40bf8e8b3f7c10bbc1d3bf91f7ec74ea39a774ded9c4f301"},"run_id":"c7355add-1681-46ab-bf75-cfa061410cd9","schema_version":"1.0.0","status":"succeeded_with_warnings","synthetic":true,"tool_versions":{"core":"0.1.1","python":"3.11.9"},"warnings":["synthetic_only","bounded_protocol_subset","process_input_compatibility_placeholder_unused"]}
