{"artifacts":[{"path":"analysis.json","sha256":"663c63d850be599b519e1c590e43c5cce2b9c77b1bcd3befcdb3f11c56105821","size_bytes":24047},{"path":"dataset.json","sha256":"51ec042645fb3ce9f65b70ced8f6ebbbba3a2d087971086ddeb79dd1c1d46d9b","size_bytes":816},{"path":"dual/analysis.json","sha256":"663c63d850be599b519e1c590e43c5cce2b9c77b1bcd3befcdb3f11c56105821","size_bytes":24047},{"path":"dual/manifest.json","sha256":"a36c553c1d6dbe1ce994c979534dd779f88d6fd90d8b092814f42f0a406e0e43","size_bytes":700},{"path":"dual/sources/network-001.pcap","sha256":"95d947a7837cad8f488268b8f5c278b39f07f96e12dffcb20f542beb12781801","size_bytes":138},{"path":"dual/sources/network.pcap","sha256":"ced5a0aa9011c6cccb494c7c47dcad323694b30f3fd68ba1dc425b19316795e8","size_bytes":144},{"path":"dual/sources/process.csv","sha256":"423f079bf9bd6041f1c762f62ecf68398013874f7102811b2917a3d52f420e31","size_bytes":132},{"path":"dual/sources/profile.json","sha256":"d7cc4e49f4fd3bd624cd45de311f1f1c80bf76108b3b50101d7b20b73b5c20b8","size_bytes":2573},{"path":"events.json","sha256":"85cb4cdaff474309b421b063814b071dda65501ea3b8bc4edb9504f39e13e1e3","size_bytes":5276},{"path":"graph.json","sha256":"fe290cf551648d6309813dfc407484aa4ce53f74efec16fc58f8929e3a35bb7f","size_bytes":5106},{"path":"quality.json","sha256":"972f6ea745822430205de8e6c00e18b9fee3f7537ed79ba918624de0e6c43fc0","size_bytes":238}],"attempt_id":1,"config_fingerprint":"80b83bb03821b10efed6c4466bc77dbd1a897a6f24947ef361099be1469264d3","input_fingerprint":"6bfdfe59ed2dc0c8d265d8ed821721c9badc5f0906d55ac530c637a3cd27ecbe","limitations":["synthetic_only","no_attack_or_causality_decision","response_success_is_not_physical_effect","endpoint_not_authenticated_actor","configured_offsets_not_estimated","existing_bounded_protocol_subset"],"mode":"offline","result_hashes":{"events":"33f938630dc67b2b61453cd2f4490047a8dee94db0cfe4d52fcf842fd9afd73a","graph":"a022abac88a9f22b8ce16f8ebeeb7871893822a444e5feb7e9268ee7ce7ed3e8"},"run_id":"0e4bc833-aaff-4ab1-8004-ed80d56a8a11","schema_version":"1.0.0","status":"succeeded","synthetic":true,"tool_versions":{"core":"0.1.1","python":"3.11.9"},"warnings":[]}
